{
  "schema_version": "0.1.0",
  "candidate_id": "CAND-TEMPLATE-001",
  "artifact_status": "draft",
  "decision": "reject",
  "decided_at": "2026-07-31T00:00:00Z",
  "approvers": [
    {
      "actor_id": "ACT-RELEASE",
      "role": "release_authority",
      "approved_at": "2026-07-31T00:00:00Z"
    }
  ],
  "input_hashes": {
    "pack": "eefa709d41d27b9edaf348199c1f453be3ae1b73fd97d5e5c4181220e91f4aab",
    "system_manifest": "420f0694808c84c011472e35aa999e5db548079e11f9f5d183b731b6cf53cae4",
    "risk_register": "8aedf19bd48ccc9ce208ad99088ffe64c0033fafbd564910bc559cbd66acc038",
    "controls": "f48d8fe2295644ed154dd0be0dd2e2443483c56080b7f2f095350768b61ac323",
    "evaluation_cases": "a1165c7233f22499af9c3983c7327dd75b62e6c4e21afa17ab8bd4d0590fe908",
    "evidence_index": "dd55a60cb9b31266bf9b7e86115d1b73cb373379a6a6058dff2f15ef6c902162",
    "findings": "c8b395f8fbe083d9d9c82f7abc5894c91b80c6fc5986aaefcf28272c607f1ca3",
    "change_assessment": "e34d1b6128fd9b5ca6d3adb4662c481f28c43317c520de61efaccb5bd797e628"
  },
  "evidence_ids": [],
  "residual_risk_ids": [],
  "conditions": [],
  "rollback_target": "replace-with-approved-baseline-or-disable-path",
  "next_review_at": "2027-01-31T00:00:00Z"
}
