{
  "schema_version": "0.1.0",
  "candidate_id": "CAND-SUPPORT-2026-07-31",
  "artifact_status": "final",
  "decision": "approve",
  "decided_at": "2026-07-31T12:00:00Z",
  "approvers": [
    {
      "actor_id": "ACT-RELEASE",
      "role": "release_authority",
      "approved_at": "2026-07-31T12:00:00Z"
    },
    {
      "actor_id": "ACT-SECURITY",
      "role": "security_reviewer",
      "approved_at": "2026-07-31T11:50:00Z"
    },
    {
      "actor_id": "ACT-PRIVACY",
      "role": "privacy_reviewer",
      "approved_at": "2026-07-31T11:50:00Z"
    },
    {
      "actor_id": "ACT-INDEPENDENT",
      "role": "independent_reviewer",
      "approved_at": "2026-07-31T11:55:00Z"
    }
  ],
  "input_hashes": {
    "pack": "6a5aee2655019f2fad666346a75fbcdbcee1d88bf123c01bb62980eb8ef273b0",
    "system_manifest": "fc3afe81bd691c489e49d244e3038afcf87e671ac6fb41f54027f60e8abe1257",
    "risk_register": "ffc0af84807e469143edc9fc519f8ae290c04e8ec5c73a09d5354a4a54cc0ada",
    "controls": "a108e4f7655df6874532926cdc724dce860a8adbf995011b37d903f804596ebc",
    "evaluation_cases": "25e5492be2c00f979ffc57b26298e0dae3fa7770500cdab3f4a631f85535e9cd",
    "evidence_index": "c158a5e2335916bc0dddde1fa0ded94c2fe21099a0e4dc35c9d3ff874dfc2fc5",
    "findings": "ac343c8ae1c3e29b494bbdf35c38ca251e9d1a87c83ead1f5d22a87182dd31ce",
    "change_assessment": "10b5ac439aa2bdc831147f234288708ab7a563d4df4101e07d4ae260b506e597"
  },
  "evidence_ids": [
    "EVID-EVALUATION",
    "EVID-SECURITY",
    "EVID-REDTEAM",
    "EVID-PRIVACY",
    "EVID-GRADER",
    "EVID-MONITORING",
    "EVID-INCIDENT",
    "EVID-ROLLBACK",
    "EVID-OVERSIGHT",
    "EVID-INJECTION-RETEST"
  ],
  "residual_risk_ids": [
    "RISK-DISCLOSURE",
    "RISK-INJECTION",
    "RISK-UNSUPPORTED",
    "RISK-PRIVACY",
    "RISK-AVAILABILITY"
  ],
  "conditions": [],
  "rollback_target": "support-assistant-disabled",
  "next_review_at": "2026-09-13T12:00:00Z"
}
